level,lemma,pos,article,plural,gender,translation_pt,example_de,example_pt,topic,difficulty_note
C2,Aporetik,noun,die,,fem,aporética,"Die Aporetik des Problems ist offensichtlich.","A aporética do problema é evidente.",Philosophie,Sem plural; muito especializado
C2,Deduktion,noun,die,Deduktionen,fem,dedução,"Durch Deduktion gelangt man zur Schlussfolgerung.","Através da dedução chega-se à conclusão.",Wissenschaft,Plural com -en; lógica formal
C2,Induktion,noun,die,Induktionen,fem,indução,"Die Induktion schließt vom Besonderen auf das Allgemeine.","A indução vai do particular para o geral.",Wissenschaft,Plural com -en; lógica formal
C2,Axiom,noun,das,Axiome,neutro,axioma,"Dieses Axiom ist nicht beweisbar.","Este axioma não é demonstrável.",Wissenschaft,Plural com -e; do grego; matemática e filosofia
C2,Phänomenologie,noun,die,,fem,fenomenologia,"Die Phänomenologie untersucht das Erleben.","A fenomenologia estuda a experiência vivida.",Philosophie,Sem plural; Husserl; muito especializado
C2,Determinismus,noun,der,,masc,determinismo,"Der Determinismus leugnet den freien Willen.","O determinismo nega o livre arbítrio.",Philosophie,Sem plural; sufixo -ismus masculino
C2,Kontingenz,noun,die,,fem,contingência,"Kontingenz bedeutet: es hätte auch anders sein können.","Contingência significa que poderia ter sido de outra forma.",Philosophie,Sem plural; do latim contingentia
C2,Transzendenz,noun,die,,fem,transcendência,"Transzendenz bezieht sich auf das Übernatürliche.","A transcendência refere-se ao sobrenatural.",Philosophie,Sem plural; sufixo -enz feminino
C2,Intersubjektivität,noun,die,,fem,intersubjetividade,"Intersubjektivität ist Grundlage sozialer Erkenntnis.","A intersubjetividade é base do conhecimento social.",Philosophie,Sem plural; composto técnico
C2,nuanciert,adj,,,,nuançado/matizado,"Seine Analyse ist sehr nuanciert.","A sua análise é muito nuançada.",Adj-C2,Particípio de nuancieren; C2 pela precisão conceptual
C2,vielschichtig,adj,,,,multifacetado/complexo,"Das Problem ist vielschichtig.","O problema é multifacetado.",Adj-C2,Composto: viel + Schicht + -ig
C2,stringent,adj,,,,rigoroso/estrito (argumento),"Die Argumentation muss stringent sein.","A argumentação tem de ser rigorosa.",Adj-C2,Do latim stringens; académico
C2,prägnant,adj,,,,preciso/conciso/marcante,"Formulieren Sie es prägnant!","Formule-o de forma precisa!",Adj-C2,Do latim praegnans; estilo académico e literário
C2,paradigmatisch,adj,,,,paradigmático,"Das ist ein paradigmatisches Beispiel.","Este é um exemplo paradigmático.",Adj-C2,De Paradigma; académico
C2,konstitutiv,adj,,,,constitutivo/fundamental,"Sprache ist konstitutiv für Denken.","A linguagem é constitutiva do pensamento.",Adj-C2,Do latim; filosofia da linguagem
C2,apodiktisch,adj,,,,apodítico/indubitável,"Eine apodiktische Aussage lässt keinen Zweifel.","Uma afirmação apodítica não admite dúvida.",Adj-C2,Grego apodeiktikos; lógica formal; muito especializado
C2,rekursiv,adj,,,,recursivo,"Das ist eine rekursive Struktur.","Esta é uma estrutura recursiva.",Adj-C2,Do latim; matemática e linguística
C2,elliptisch,adj,,,,elíptico,"Der Satz ist elliptisch.","A frase é elíptica.",Adj-C2,Do grego ellipsis; linguística e retórica
C2,idiomatisch,adj,,,,idiomático,"Diese Wendung ist idiomatisch.","Esta expressão é idiomática.",Adj-C2,De Idiom; fundamental para domínio C2
